{
  "seq": 1,
  "prev_hash": "0000000000000000000000000000000000000000000000000000000000000000",
  "this_hash": "1111111111111111111111111111111111111111111111111111111111111111",
  "kind": "check.completed",
  "principal_chain": [
    "agent:runner-01"
  ],
  "payload": "{\"memo_key\":\"deadbeef\",\"exit\":0}",
  "recorded_at": 1717000001000
}
